
Showing logs for build [32mseldonio-seldon-core-pr-2149-li-ptfwh-23[0m stage [32mpr-build-comment[0m and container [32mstep-credential-initializer-bhl6b[0m
{"level":"info","ts":1595052019.421875,"logger":"fallback-logger","caller":"logging/config.go:69","msg":"Fetch GitHub commit ID from kodata failed: open /var/run/ko/refs/heads/0.8.0-ns-support: no such file or directory"}
{"level":"info","ts":1595052019.4224846,"logger":"fallback-logger","caller":"creds-init/main.go:40","msg":"Credentials initialized."}

Showing logs for build [32mseldonio-seldon-core-pr-2149-li-ptfwh-23[0m stage [32mpr-build-comment[0m and container [32mstep-working-dir-initializer-8dr5k[0m
{"level":"info","ts":1595052020.5462124,"logger":"fallback-logger","caller":"logging/config.go:69","msg":"Fetch GitHub commit ID from kodata failed: open /var/run/ko/HEAD: no such file or directory"}
{"level":"info","ts":1595052020.5476372,"logger":"fallback-logger","caller":"bash/main.go:64","msg":"Successfully executed command \"sh -c mkdir -p /workspace/source\"; output "}

Showing logs for build [32mseldonio-seldon-core-pr-2149-li-ptfwh-23[0m stage [32mpr-build-comment[0m and container [32mstep-place-tools[0m

Showing logs for build [32mseldonio-seldon-core-pr-2149-li-ptfwh-23[0m stage [32mpr-build-comment[0m and container [32mstep-create-dir-workspace-pbnqx[0m
{"level":"info","ts":1595052025.7281868,"logger":"fallback-logger","caller":"logging/config.go:69","msg":"Fetch GitHub commit ID from kodata failed: open /var/run/ko/HEAD: no such file or directory"}
{"level":"info","ts":1595052025.7297559,"logger":"fallback-logger","caller":"bash/main.go:64","msg":"Successfully executed command \"sh -c mkdir -p source\"; output "}

Showing logs for build [32mseldonio-seldon-core-pr-2149-li-ptfwh-23[0m stage [32mpr-build-comment[0m and container [32mstep-git-source-seldonio-seldon-core-pr-2149-li-ptfwh-spwdk[0m
{"level":"info","ts":1595052025.9889026,"logger":"fallback-logger","caller":"logging/config.go:69","msg":"Fetch GitHub commit ID from kodata failed: open /var/run/ko/refs/heads/0.8.0-ns-support: no such file or directory"}
{"level":"info","ts":1595052030.8809435,"logger":"fallback-logger","caller":"git/git.go:103","msg":"Successfully cloned https://github.com/SeldonIO/seldon-core.git @ master in path /workspace/source"}

Showing logs for build [32mseldonio-seldon-core-pr-2149-li-ptfwh-23[0m stage [32mpr-build-comment[0m and container [32mstep-setup-builder-home[0m

Showing logs for build [32mseldonio-seldon-core-pr-2149-li-ptfwh-23[0m stage [32mpr-build-comment[0m and container [32mstep-git-merge[0m
Using SHAs from PULL_REFS=master:296d02420fb3010cbb7155795099d023d9c35e57,2149:a04ed2882adafc5994b239ea12fe2bdf4aec86ee
DEBUG: LC_ALL=C JX_LOG_LEVEL=error git fetch origin --unshallow a04ed2882adafc5994b239ea12fe2bdf4aec86ee: 296d02420fb3010cbb7155795099d023d9c35e57:
DEBUG: ran git fetch --unshallow origin a04ed2882adafc5994b239ea12fe2bdf4aec86ee: 296d02420fb3010cbb7155795099d023d9c35e57: in 
DEBUG: LC_ALL=C JX_LOG_LEVEL=error git branch
DEBUG: LC_ALL=C JX_LOG_LEVEL=error git checkout master
DEBUG: ran git checkout master in 
DEBUG: LC_ALL=C JX_LOG_LEVEL=error git reset --hard 296d02420fb3010cbb7155795099d023d9c35e57
DEBUG: ran git reset --hard 296d02420fb3010cbb7155795099d023d9c35e57 in 
DEBUG: LC_ALL=C JX_LOG_LEVEL=error git clean -fd .
DEBUG: ran clean --force -d . in 
DEBUG: LC_ALL=C JX_LOG_LEVEL=error git merge a04ed2882adafc5994b239ea12fe2bdf4aec86ee
DEBUG: ran git merge a04ed2882adafc5994b239ea12fe2bdf4aec86ee in 
DEBUG: LC_ALL=C JX_LOG_LEVEL=error git log --format=%H%x1f%an%x1f%ae%x1f%cn%x1f%ce%x1f%s%n%b%x1e 296d02420fb3010cbb7155795099d023d9c35e57..HEAD
Merged SHA ae85782031cbdbbd9c91acd5ec0448a37ba9dc4f with commit message 'Merge commit 'a04ed2882adafc5994b239ea12fe2bdf4aec86ee'' into base branch master
Merged SHA a04ed2882adafc5994b239ea12fe2bdf4aec86ee with commit message 'Updated makefiles' into base branch master
Merged SHA 7585c98cc808449df55f276e5624a515fe36e98e with commit message 'Updated makefiles' into base branch master
Merged SHA ad9c917fe8e9413ea362c2796e5941b444a14df5 with commit message 'Updated jenkins files' into base branch master
Merged SHA 65d30326af5493f91324fde169c9f3c49521bdef with commit message 'Updated core builder' into base branch master
Merged SHA 7be1b1c519eb67fb6f17efe0635f1794b8345c81 with commit message 'Testing main comment' into base branch master
Merged SHA aa7524c33f2c1a0e8e504af170597c96a6114af5 with commit message 'Testing main comment' into base branch master
Merged SHA ea7064b58b3154053c131140aa3c99169ea5a0bf with commit message 'Testing main comment' into base branch master
Merged SHA d2bdaebf8a877abbbc11b2213e6a799204d01ffb with commit message 'Testing main comment' into base branch master
Merged SHA 914888dea31b05a61385642addc814d4ec53e207 with commit message 'Added override for temp fast build' into base branch master
Merged SHA 781be799063bf1fc4fab5a8b4d81e11ba76a1cdc with commit message 'Added override for temp fast build' into base branch master
Merged SHA fd73daa0dbf8ea4270effe173563d12e59224bd2 with commit message 'updated pipeline to test other pre/post' into base branch master
Merged SHA 501cbc7f51ddd8d21105eb82eaf0486faf496e58 with commit message 'Fixed formating on yaml' into base branch master
Merged SHA fef171f7d4110d0823798702ba7b3468236cb094 with commit message 'Added pipeline pre/post check' into base branch master

Showing logs for build [32mseldonio-seldon-core-pr-2149-li-ptfwh-23[0m stage [32mpr-build-comment[0m and container [32mstep-step2[0m
+++ dirname ./add-pr-build-comment
++ cd .
++ pwd
+ STARTUP_DIR=/workspace/source/ci
+ REPO_OWNER=SeldonIO
+ REPO_NAME=seldon-core
+ PULL_NUMBER=2149
+ BUILD_NUMBER=23
+ PIPELINE_CONTEXT=lint
++ cat
+++ date
+ COMMENT_MSG='Sat Jul 18 06:00:38 UTC 2020
The logs for [lint] [23] will show after the pipeline context has finished.  
https://github.com/SeldonIO/seldon-core/blob/gh-pages/jenkins-x/logs/SeldonIO/seldon-core/PR-2149/23.log

impatient try  
** get build logs SeldonIO/seldon-core/PR-2149 --build=23'
+ ** step pr comment --owner=SeldonIO --repository=seldon-core --pull-request=2149 '--comment=Sat Jul 18 06:00:38 UTC 2020
The logs for [lint] [23] will show after the pipeline context has finished.  
https://github.com/SeldonIO/seldon-core/blob/gh-pages/jenkins-x/logs/SeldonIO/seldon-core/PR-2149/23.log

impatient try  
** get build logs SeldonIO/seldon-core/PR-2149 --build=23'

Showing logs for build [32mseldonio-seldon-core-pr-2149-li-ptfwh-23[0m stage [32mpr-build-comment[0m and container [32mstep-source-mkdir-seldonio-seldon-core-pr-2149-li-ptfwh-4c62k[0m
{"level":"info","ts":1595052040.9731154,"logger":"fallback-logger","caller":"logging/config.go:69","msg":"Fetch GitHub commit ID from kodata failed: open /var/run/ko/HEAD: no such file or directory"}
{"level":"info","ts":1595052040.977701,"logger":"fallback-logger","caller":"bash/main.go:64","msg":"Successfully executed command \"sh -c mkdir -p /pvc/pr-build-comment/workspace\"; output "}

Showing logs for build [32mseldonio-seldon-core-pr-2149-li-ptfwh-23[0m stage [32mpr-build-comment[0m and container [32mstep-source-copy-seldonio-seldon-core-pr-2149-li-ptfwh-5v9fd[0m
{"level":"info","ts":1595052041.222013,"logger":"fallback-logger","caller":"logging/config.go:69","msg":"Fetch GitHub commit ID from kodata failed: open /var/run/ko/HEAD: no such file or directory"}
{"level":"info","ts":1595052041.5825863,"logger":"fallback-logger","caller":"bash/main.go:64","msg":"Successfully executed command \"sh -c cp -r source/. /pvc/pr-build-comment/workspace\"; output "}

Showing logs for build [32mseldonio-seldon-core-pr-2149-li-ptfwh-23[0m stage [32mlint-operator[0m and container [32mstep-credential-initializer-2zpkj[0m
{"level":"info","ts":1595052045.5491755,"logger":"fallback-logger","caller":"logging/config.go:69","msg":"Fetch GitHub commit ID from kodata failed: open /var/run/ko/refs/heads/0.8.0-ns-support: no such file or directory"}
{"level":"info","ts":1595052045.5496757,"logger":"fallback-logger","caller":"creds-init/main.go:40","msg":"Credentials initialized."}

Showing logs for build [32mseldonio-seldon-core-pr-2149-li-ptfwh-23[0m stage [32mlint-operator[0m and container [32mstep-working-dir-initializer-kgsv9[0m
{"level":"info","ts":1595052046.8478396,"logger":"fallback-logger","caller":"logging/config.go:69","msg":"Fetch GitHub commit ID from kodata failed: open /var/run/ko/HEAD: no such file or directory"}
{"level":"info","ts":1595052046.8495154,"logger":"fallback-logger","caller":"bash/main.go:64","msg":"Successfully executed command \"sh -c mkdir -p /workspace/source\"; output "}

Showing logs for build [32mseldonio-seldon-core-pr-2149-li-ptfwh-23[0m stage [32mlint-operator[0m and container [32mstep-place-tools[0m

Showing logs for build [32mseldonio-seldon-core-pr-2149-li-ptfwh-23[0m stage [32mlint-operator[0m and container [32mstep-create-dir-workspace-7db7s[0m
{"level":"info","ts":1595052055.5938888,"logger":"fallback-logger","caller":"logging/config.go:69","msg":"Fetch GitHub commit ID from kodata failed: open /var/run/ko/HEAD: no such file or directory"}
{"level":"info","ts":1595052055.5955145,"logger":"fallback-logger","caller":"bash/main.go:64","msg":"Successfully executed command \"sh -c mkdir -p /workspace/source\"; output "}

Showing logs for build [32mseldonio-seldon-core-pr-2149-li-ptfwh-23[0m stage [32mlint-operator[0m and container [32mstep-source-copy-workspace-2kgp8[0m
{"level":"info","ts":1595052055.8786352,"logger":"fallback-logger","caller":"logging/config.go:69","msg":"Fetch GitHub commit ID from kodata failed: open /var/run/ko/HEAD: no such file or directory"}
{"level":"info","ts":1595052056.2956328,"logger":"fallback-logger","caller":"bash/main.go:64","msg":"Successfully executed command \"sh -c cp -r /pvc/pr-build-comment/workspace/. /workspace/source\"; output "}

Showing logs for build [32mseldonio-seldon-core-pr-2149-li-ptfwh-23[0m stage [32mlint-operator[0m and container [32mstep-setup-builder-home[0m

Showing logs for build [32mseldonio-seldon-core-pr-2149-li-ptfwh-23[0m stage [32mlint-operator[0m and container [32mstep-lint-operator[0m
make: Entering directory '/workspace/source/operator'
# Check if licenses have changed
git \
	--no-pager diff \
	--exit-code \
	./licenses
make: Leaving directory '/workspace/source/operator'

Showing logs for build [32mseldonio-seldon-core-pr-2149-li-ptfwh-23[0m stage [32mlint-python[0m and container [32mstep-credential-initializer-dlrwb[0m
{"level":"info","ts":1595052044.3954158,"logger":"fallback-logger","caller":"logging/config.go:69","msg":"Fetch GitHub commit ID from kodata failed: open /var/run/ko/refs/heads/0.8.0-ns-support: no such file or directory"}
{"level":"info","ts":1595052044.3959491,"logger":"fallback-logger","caller":"creds-init/main.go:40","msg":"Credentials initialized."}

Showing logs for build [32mseldonio-seldon-core-pr-2149-li-ptfwh-23[0m stage [32mlint-python[0m and container [32mstep-working-dir-initializer-dl7c4[0m
{"level":"info","ts":1595052045.6928499,"logger":"fallback-logger","caller":"logging/config.go:69","msg":"Fetch GitHub commit ID from kodata failed: open /var/run/ko/HEAD: no such file or directory"}
{"level":"info","ts":1595052045.6947348,"logger":"fallback-logger","caller":"bash/main.go:64","msg":"Successfully executed command \"sh -c mkdir -p /workspace/source\"; output "}

Showing logs for build [32mseldonio-seldon-core-pr-2149-li-ptfwh-23[0m stage [32mlint-python[0m and container [32mstep-place-tools[0m

Showing logs for build [32mseldonio-seldon-core-pr-2149-li-ptfwh-23[0m stage [32mlint-python[0m and container [32mstep-create-dir-workspace-95fn2[0m
{"level":"info","ts":1595052052.942321,"logger":"fallback-logger","caller":"logging/config.go:69","msg":"Fetch GitHub commit ID from kodata failed: open /var/run/ko/HEAD: no such file or directory"}
{"level":"info","ts":1595052052.9442403,"logger":"fallback-logger","caller":"bash/main.go:64","msg":"Successfully executed command \"sh -c mkdir -p /workspace/source\"; output "}

Showing logs for build [32mseldonio-seldon-core-pr-2149-li-ptfwh-23[0m stage [32mlint-python[0m and container [32mstep-source-copy-workspace-8wkc7[0m
{"level":"info","ts":1595052053.1902332,"logger":"fallback-logger","caller":"logging/config.go:69","msg":"Fetch GitHub commit ID from kodata failed: open /var/run/ko/HEAD: no such file or directory"}
{"level":"info","ts":1595052053.5599082,"logger":"fallback-logger","caller":"bash/main.go:64","msg":"Successfully executed command \"sh -c cp -r /pvc/pr-build-comment/workspace/. /workspace/source\"; output "}

Showing logs for build [32mseldonio-seldon-core-pr-2149-li-ptfwh-23[0m stage [32mlint-python[0m and container [32mstep-setup-builder-home[0m

Showing logs for build [32mseldonio-seldon-core-pr-2149-li-ptfwh-23[0m stage [32mlint-python[0m and container [32mstep-lint-python[0m
make: Entering directory '/workspace/source/python'
pip install -e . -r requirements-dev.txt
Obtaining file:///workspace/source/python
Collecting Flask<2.0.0
  Downloading Flask-1.1.2-py2.py3-none-any.whl (94 kB)
Requirement already satisfied: jsonschema<4.0.0 in /usr/local/lib/python3.6/site-packages (from -r requirements.txt (line 2)) (3.2.0)
Collecting Flask-cors<4.0.0
  Downloading Flask_Cors-3.0.8-py2.py3-none-any.whl (14 kB)
Collecting redis<4.0.0
  Downloading redis-3.5.3-py2.py3-none-any.whl (72 kB)
Requirement already satisfied: requests<3.0.0 in /usr/local/lib/python3.6/site-packages (from -r requirements.txt (line 5)) (2.23.0)
Requirement already satisfied: numpy<2.0.0 in /usr/local/lib/python3.6/site-packages (from -r requirements.txt (line 6)) (1.18.4)
Collecting flatbuffers<2.0.0
  Downloading flatbuffers-1.12-py2.py3-none-any.whl (15 kB)
Requirement already satisfied: protobuf<4.0.0 in /usr/local/lib/python3.6/site-packages (from -r requirements.txt (line 8)) (3.12.1)
Requirement already satisfied: grpcio<2.0.0 in /usr/local/lib/python3.6/site-packages (from -r requirements.txt (line 9)) (1.29.0)
Collecting Flask-OpenTracing<1.2.0,>=1.1.0
  Downloading Flask-OpenTracing-1.1.0.tar.gz (8.2 kB)
Collecting opentracing<2.3.0,>=2.2.0
  Downloading opentracing-2.2.0.tar.gz (47 kB)
Collecting jaeger-client<4.2.0,>=4.1.0
  Downloading jaeger-client-4.1.0.tar.gz (80 kB)
Collecting grpcio-opentracing<1.2.0,>=1.1.4
  Downloading grpcio_opentracing-1.1.4-py3-none-any.whl (14 kB)
Requirement already satisfied: PyYAML<5.4 in /usr/local/lib/python3.6/site-packages (from -r requirements.txt (line 14)) (5.3.1)
Collecting gunicorn<20.1.0,>=19.9.0
  Downloading gunicorn-20.0.4-py2.py3-none-any.whl (77 kB)
Collecting minio<6.0.0,>=4.0.9
  Downloading minio-5.0.10-py2.py3-none-any.whl (75 kB)
Collecting azure-storage-blob<3.0.0,>=2.0.1
  Downloading azure_storage_blob-2.1.0-py2.py3-none-any.whl (88 kB)
Requirement already satisfied: setuptools>=41.0.0 in /usr/local/lib/python3.6/site-packages (from -r requirements.txt (line 18)) (46.4.0)
Collecting google-cloud-storage>=1.16.0
  Downloading google_cloud_storage-1.29.0-py2.py3-none-any.whl (85 kB)
Requirement already satisfied: prometheus_client<0.9.0,>=0.7.1 in /usr/local/lib/python3.6/site-packages (from -r requirements.txt (line 20)) (0.7.1)
Collecting black==19.10b0
  Downloading black-19.10b0-py36-none-any.whl (97 kB)
Collecting flake8==3.8.1
  Downloading flake8-3.8.1-py2.py3-none-any.whl (72 kB)
Collecting mypy<0.783
  Downloading mypy-0.782-cp36-cp36m-manylinux1_x86_64.whl (20.8 MB)
Collecting Pillow==7.2.0
  Downloading Pillow-7.2.0-cp36-cp36m-manylinux1_x86_64.whl (2.2 MB)
Collecting pytest==5.4.2
  Downloading pytest-5.4.2-py3-none-any.whl (247 kB)
Collecting pytest-cov==2.10.0
  Downloading pytest_cov-2.10.0-py2.py3-none-any.whl (19 kB)
Collecting tox<4.0.0
  Downloading tox-3.17.1-py2.py3-none-any.whl (82 kB)
Collecting grpcio-tools==1.30.0
  Downloading grpcio_tools-1.30.0-cp36-cp36m-manylinux2010_x86_64.whl (2.5 MB)
Collecting mypy-protobuf==1.22
  Downloading mypy_protobuf-1.22-py3-none-any.whl (7.5 kB)
Collecting tenacity==6.2.0
  Downloading tenacity-6.2.0-py2.py3-none-any.whl (24 kB)
Collecting coverage==5.2
  Downloading coverage-5.2-cp36-cp36m-manylinux1_x86_64.whl (229 kB)
Collecting pandas==1.0.1
  Downloading pandas-1.0.1-cp36-cp36m-manylinux1_x86_64.whl (10.1 MB)
Collecting pip-licenses==2.2.1
  Downloading pip_licenses-2.2.1-py3-none-any.whl (14 kB)
Requirement already satisfied: Jinja2>=2.10.1 in /usr/local/lib/python3.6/site-packages (from Flask<2.0.0->-r requirements.txt (line 1)) (2.11.2)
Requirement already satisfied: Werkzeug>=0.15 in /usr/local/lib/python3.6/site-packages (from Flask<2.0.0->-r requirements.txt (line 1)) (1.0.1)
Collecting itsdangerous>=0.24
  Downloading itsdangerous-1.1.0-py2.py3-none-any.whl (16 kB)
Collecting click>=5.1
  Downloading click-7.1.2-py2.py3-none-any.whl (82 kB)
Requirement already satisfied: six>=1.11.0 in /usr/local/lib/python3.6/site-packages (from jsonschema<4.0.0->-r requirements.txt (line 2)) (1.15.0)
Requirement already satisfied: pyrsistent>=0.14.0 in /usr/local/lib/python3.6/site-packages (from jsonschema<4.0.0->-r requirements.txt (line 2)) (0.16.0)
Requirement already satisfied: attrs>=17.4.0 in /usr/local/lib/python3.6/site-packages (from jsonschema<4.0.0->-r requirements.txt (line 2)) (19.3.0)
Requirement already satisfied: importlib-metadata; python_version < "3.8" in /usr/local/lib/python3.6/site-packages (from jsonschema<4.0.0->-r requirements.txt (line 2)) (1.6.0)
Requirement already satisfied: chardet<4,>=3.0.2 in /usr/local/lib/python3.6/site-packages (from requests<3.0.0->-r requirements.txt (line 5)) (3.0.4)
Requirement already satisfied: certifi>=2017.4.17 in /usr/local/lib/python3.6/site-packages (from requests<3.0.0->-r requirements.txt (line 5)) (2020.4.5.1)
Requirement already satisfied: urllib3!=1.25.0,!=1.25.1,<1.26,>=1.21.1 in /usr/local/lib/python3.6/site-packages (from requests<3.0.0->-r requirements.txt (line 5)) (1.25.9)
Requirement already satisfied: idna<3,>=2.5 in /usr/local/lib/python3.6/site-packages (from requests<3.0.0->-r requirements.txt (line 5)) (2.9)
Collecting threadloop<2,>=1
  Downloading threadloop-1.0.2.tar.gz (4.9 kB)
Collecting thrift
  Downloading thrift-0.13.0.tar.gz (59 kB)
Collecting tornado<6,>=4.3
  Downloading tornado-5.1.1.tar.gz (516 kB)
Requirement already satisfied: python-dateutil in /usr/local/lib/python3.6/site-packages (from minio<6.0.0,>=4.0.9->-r requirements.txt (line 16)) (2.8.1)
Requirement already satisfied: pytz in /usr/local/lib/python3.6/site-packages (from minio<6.0.0,>=4.0.9->-r requirements.txt (line 16)) (2020.1)
Collecting configparser
  Downloading configparser-5.0.0-py3-none-any.whl (22 kB)
Collecting azure-storage-common~=2.1
  Downloading azure_storage_common-2.1.0-py2.py3-none-any.whl (47 kB)
Collecting azure-common>=1.1.5
  Downloading azure_common-1.1.25-py2.py3-none-any.whl (12 kB)
Collecting google-auth<2.0dev,>=1.11.0
  Downloading google_auth-1.19.2-py2.py3-none-any.whl (91 kB)
Collecting google-resumable-media<0.6dev,>=0.5.0
  Downloading google_resumable_media-0.5.1-py2.py3-none-any.whl (38 kB)
Collecting google-cloud-core<2.0dev,>=1.2.0
  Downloading google_cloud_core-1.3.0-py2.py3-none-any.whl (26 kB)
Collecting typed-ast>=1.4.0
  Downloading typed_ast-1.4.1-cp36-cp36m-manylinux1_x86_64.whl (737 kB)
Collecting appdirs
  Downloading appdirs-1.4.4-py2.py3-none-any.whl (9.6 kB)
Collecting pathspec<1,>=0.6
  Downloading pathspec-0.8.0-py2.py3-none-any.whl (28 kB)
Collecting regex
  Downloading regex-2020.7.14-cp36-cp36m-manylinux2010_x86_64.whl (660 kB)
Collecting toml>=0.9.4
  Downloading toml-0.10.1-py2.py3-none-any.whl (19 kB)
Collecting pycodestyle<2.7.0,>=2.6.0a1
  Downloading pycodestyle-2.6.0-py2.py3-none-any.whl (41 kB)
Collecting pyflakes<2.3.0,>=2.2.0
  Downloading pyflakes-2.2.0-py2.py3-none-any.whl (66 kB)
Collecting mccabe<0.7.0,>=0.6.0
  Downloading mccabe-0.6.1-py2.py3-none-any.whl (8.6 kB)
Collecting mypy-extensions<0.5.0,>=0.4.3
  Downloading mypy_extensions-0.4.3-py2.py3-none-any.whl (4.5 kB)
Collecting typing-extensions>=3.7.4
  Downloading typing_extensions-3.7.4.2-py3-none-any.whl (22 kB)
Requirement already satisfied: packaging in /usr/local/lib/python3.6/site-packages (from pytest==5.4.2->-r requirements-dev.txt (line 6)) (20.4)
Requirement already satisfied: py>=1.5.0 in /usr/local/lib/python3.6/site-packages (from pytest==5.4.2->-r requirements-dev.txt (line 6)) (1.8.1)
Requirement already satisfied: more-itertools>=4.0.0 in /usr/local/lib/python3.6/site-packages (from pytest==5.4.2->-r requirements-dev.txt (line 6)) (8.3.0)
Requirement already satisfied: wcwidth in /usr/local/lib/python3.6/site-packages (from pytest==5.4.2->-r requirements-dev.txt (line 6)) (0.1.9)
Requirement already satisfied: pluggy<1.0,>=0.12 in /usr/local/lib/python3.6/site-packages (from pytest==5.4.2->-r requirements-dev.txt (line 6)) (0.13.1)
Collecting virtualenv!=20.0.0,!=20.0.1,!=20.0.2,!=20.0.3,!=20.0.4,!=20.0.5,!=20.0.6,!=20.0.7,>=16.0.0
  Downloading virtualenv-20.0.27-py2.py3-none-any.whl (4.9 MB)
Collecting filelock>=3.0.0
  Downloading filelock-3.0.12-py3-none-any.whl (7.6 kB)
Collecting PTable
  Downloading PTable-0.9.2.tar.gz (31 kB)
Requirement already satisfied: MarkupSafe>=0.23 in /usr/local/lib/python3.6/site-packages (from Jinja2>=2.10.1->Flask<2.0.0->-r requirements.txt (line 1)) (1.1.1)
Requirement already satisfied: zipp>=0.5 in /usr/local/lib/python3.6/site-packages (from importlib-metadata; python_version < "3.8"->jsonschema<4.0.0->-r requirements.txt (line 2)) (3.1.0)
Collecting cryptography
  Downloading cryptography-2.9.2-cp35-abi3-manylinux2010_x86_64.whl (2.7 MB)
Collecting pyasn1-modules>=0.2.1
  Downloading pyasn1_modules-0.2.8-py2.py3-none-any.whl (155 kB)
Collecting cachetools<5.0,>=2.0.0
  Downloading cachetools-4.1.1-py3-none-any.whl (10 kB)
Collecting rsa<5,>=3.1.4; python_version >= "3"
  Downloading rsa-4.6-py3-none-any.whl (47 kB)
Collecting google-api-core<2.0.0dev,>=1.16.0
  Downloading google_api_core-1.21.0-py2.py3-none-any.whl (90 kB)
Requirement already satisfied: pyparsing>=2.0.2 in /usr/local/lib/python3.6/site-packages (from packaging->pytest==5.4.2->-r requirements-dev.txt (line 6)) (2.4.7)
Collecting distlib<1,>=0.3.1
  Downloading distlib-0.3.1-py2.py3-none-any.whl (335 kB)
Collecting importlib-resources>=1.0; python_version < "3.7"
  Downloading importlib_resources-3.0.0-py2.py3-none-any.whl (23 kB)
Collecting cffi!=1.11.3,>=1.8
  Downloading cffi-1.14.0-cp36-cp36m-manylinux1_x86_64.whl (399 kB)
Collecting pyasn1<0.5.0,>=0.4.6
  Downloading pyasn1-0.4.8-py2.py3-none-any.whl (77 kB)
Collecting googleapis-common-protos<2.0dev,>=1.6.0
  Downloading googleapis_common_protos-1.52.0-py2.py3-none-any.whl (100 kB)
Collecting pycparser
  Downloading pycparser-2.20-py2.py3-none-any.whl (112 kB)
Building wheels for collected packages: Flask-OpenTracing, opentracing, jaeger-client, threadloop, thrift, tornado, PTable
  Building wheel for Flask-OpenTracing (setup.py): started
  Building wheel for Flask-OpenTracing (setup.py): finished with status 'done'
  Created wheel for Flask-OpenTracing: filename=Flask_OpenTracing-1.1.0-py3-none-any.whl size=9070 sha256=fdda7013ed4d02cbfa045a0e14114afe5797124bbbc3f8ba49b4b0bb640d8568
  Stored in directory: /builder/home/.cache/pip/wheels/ad/4b/2d/24ff0da0a0b53c7c77ce59b843bcceaf644c88703241e59615
  Building wheel for opentracing (setup.py): started
  Building wheel for opentracing (setup.py): finished with status 'done'
  Created wheel for opentracing: filename=opentracing-2.2.0-py3-none-any.whl size=49319 sha256=5d46ede7573c2193015911e7b3ba3002cb3562fc4cacd578624cfac9c2e0902d
  Stored in directory: /builder/home/.cache/pip/wheels/39/40/44/8bace79f4514e99786236c31f1df8d1b814ff02c1e08b1d697
  Building wheel for jaeger-client (setup.py): started
  Building wheel for jaeger-client (setup.py): finished with status 'done'
  Created wheel for jaeger-client: filename=jaeger_client-4.1.0-py3-none-any.whl size=64309 sha256=0337a22928a0ddecada81d5d872d10739f6b065ce62598b8fe93ddb16aaa5373
  Stored in directory: /builder/home/.cache/pip/wheels/e9/9b/8c/503d0cc13b39a551c054515683ba1d15b40324c863dc442e66
  Building wheel for threadloop (setup.py): started
  Building wheel for threadloop (setup.py): finished with status 'done'
  Created wheel for threadloop: filename=threadloop-1.0.2-py3-none-any.whl size=3423 sha256=52d6dbded8aa9e636643abc4c929de25dc7ca30d5ff32d18ee8d0d795f6ffb11
  Stored in directory: /builder/home/.cache/pip/wheels/02/54/65/9f87de48fe8fcaaee30f279973d946ad55f9df56b93b3e78da
  Building wheel for thrift (setup.py): started
  Building wheel for thrift (setup.py): finished with status 'done'
  Created wheel for thrift: filename=thrift-0.13.0-cp36-cp36m-linux_x86_64.whl size=483893 sha256=d0b50bbc0d9a318c3d58f9430047d9baac0c2ee84dfe6de319261fdb27dbfec7
  Stored in directory: /builder/home/.cache/pip/wheels/e0/38/fc/472fe18756b177b42096961f8bd3ff2dc5c5620ac399fce52d
  Building wheel for tornado (setup.py): started
  Building wheel for tornado (setup.py): finished with status 'done'
  Created wheel for tornado: filename=tornado-5.1.1-cp36-cp36m-linux_x86_64.whl size=462650 sha256=eb3edf0446587193d956facb267ad57909f36ddd6d34bd45a7a0acbcd0599c84
  Stored in directory: /builder/home/.cache/pip/wheels/64/74/71/e7a0d0eb4fc42cb20a17aec36f8f0b5b8c5e1ec19c701fd34a
  Building wheel for PTable (setup.py): started
  Building wheel for PTable (setup.py): finished with status 'done'
  Created wheel for PTable: filename=PTable-0.9.2-py3-none-any.whl size=22907 sha256=7bb2fcb4d8956c0afe8c4d460ca3a760454948e0d179018076a1b1aa246653d3
  Stored in directory: /builder/home/.cache/pip/wheels/f3/65/67/71f473ec87ea4554d1bdfb1b5128cfe1414c2b113b72a1ee8e
Successfully built Flask-OpenTracing opentracing jaeger-client threadloop thrift tornado PTable
ERROR: grpcio-tools 1.30.0 has requirement grpcio>=1.30.0, but you'll have grpcio 1.29.0 which is incompatible.
Installing collected packages: itsdangerous, click, Flask, Flask-cors, redis, flatbuffers, opentracing, Flask-OpenTracing, tornado, threadloop, thrift, jaeger-client, grpcio-opentracing, gunicorn, configparser, minio, pycparser, cffi, cryptography, azure-common, azure-storage-common, azure-storage-blob, pyasn1, pyasn1-modules, cachetools, rsa, google-auth, google-resumable-media, googleapis-common-protos, google-api-core, google-cloud-core, google-cloud-storage, typed-ast, appdirs, pathspec, regex, toml, black, pycodestyle, pyflakes, mccabe, flake8, mypy-extensions, typing-extensions, mypy, Pillow, pytest, coverage, pytest-cov, filelock, distlib, importlib-resources, virtualenv, tox, grpcio-tools, mypy-protobuf, tenacity, pandas, PTable, pip-licenses, seldon-core
  Attempting uninstall: tornado
    Found existing installation: tornado 6.0.4
    Uninstalling tornado-6.0.4:
      Successfully uninstalled tornado-6.0.4
  Attempting uninstall: Pillow
    Found existing installation: Pillow 7.1.2
    Uninstalling Pillow-7.1.2:
      Successfully uninstalled Pillow-7.1.2
  Attempting uninstall: pytest
    Found existing installation: pytest 5.3.1
    Uninstalling pytest-5.3.1:
      Successfully uninstalled pytest-5.3.1
  Attempting uninstall: coverage
    Found existing installation: coverage 4.5.4
    Uninstalling coverage-4.5.4:
      Successfully uninstalled coverage-4.5.4
  Attempting uninstall: pytest-cov
    Found existing installation: pytest-cov 2.8.1
    Uninstalling pytest-cov-2.8.1:
      Successfully uninstalled pytest-cov-2.8.1
  Attempting uninstall: grpcio-tools
    Found existing installation: grpcio-tools 1.29.0
    Uninstalling grpcio-tools-1.29.0:
      Successfully uninstalled grpcio-tools-1.29.0
  Attempting uninstall: tenacity
    Found existing installation: tenacity 6.0.0
    Uninstalling tenacity-6.0.0:
      Successfully uninstalled tenacity-6.0.0
  Attempting uninstall: pandas
    Found existing installation: pandas 1.0.3
    Uninstalling pandas-1.0.3:
      Successfully uninstalled pandas-1.0.3
  Running setup.py develop for seldon-core
Successfully installed Flask-1.1.2 Flask-OpenTracing-1.1.0 Flask-cors-3.0.8 PTable-0.9.2 Pillow-7.2.0 appdirs-1.4.4 azure-common-1.1.25 azure-storage-blob-2.1.0 azure-storage-common-2.1.0 black-19.10b0 cachetools-4.1.1 cffi-1.14.0 click-7.1.2 configparser-5.0.0 coverage-5.2 cryptography-2.9.2 distlib-0.3.1 filelock-3.0.12 flake8-3.8.1 flatbuffers-1.12 google-api-core-1.21.0 google-auth-1.19.2 google-cloud-core-1.3.0 google-cloud-storage-1.29.0 google-resumable-media-0.5.1 googleapis-common-protos-1.52.0 grpcio-opentracing-1.1.4 grpcio-tools-1.30.0 gunicorn-20.0.4 importlib-resources-3.0.0 itsdangerous-1.1.0 jaeger-client-4.1.0 mccabe-0.6.1 minio-5.0.10 mypy-0.782 mypy-extensions-0.4.3 mypy-protobuf-1.22 opentracing-2.2.0 pandas-1.0.1 pathspec-0.8.0 pip-licenses-2.2.1 pyasn1-0.4.8 pyasn1-modules-0.2.8 pycodestyle-2.6.0 pycparser-2.20 pyflakes-2.2.0 pytest-5.4.2 pytest-cov-2.10.0 redis-3.5.3 regex-2020.7.14 rsa-4.6 seldon-core tenacity-6.2.0 threadloop-1.0.2 thrift-0.13.0 toml-0.10.1 tornado-5.1.1 tox-3.17.1 typed-ast-1.4.1 typing-extensions-3.7.4.2 virtualenv-20.0.27
tox --recreate -e licenses
GLOB sdist-make: /workspace/source/python/setup.py
licenses create: /workspace/source/python/.tox/licenses
licenses installdeps: pip-licenses
licenses inst: /workspace/source/python/.tox/.tmp/package/1/seldon-core-1.2.2.dev0.zip
licenses installed: absl-py==0.9.0,astunparse==1.6.3,attrs==19.3.0,azure-common==1.1.25,azure-storage-blob==2.1.0,azure-storage-common==2.1.0,cachetools==4.1.1,certifi==2020.6.20,cffi==1.14.0,chardet==3.0.4,click==7.1.2,configparser==5.0.0,cryptography==2.9.2,Flask==1.1.2,Flask-Cors==3.0.8,Flask-OpenTracing==1.1.0,flatbuffers==1.12,gast==0.3.3,google-api-core==1.21.0,google-auth==1.19.2,google-auth-oauthlib==0.4.1,google-cloud-core==1.3.0,google-cloud-storage==1.29.0,google-pasta==0.2.0,google-resumable-media==0.5.1,googleapis-common-protos==1.52.0,grpcio==1.30.0,grpcio-opentracing==1.1.4,gunicorn==20.0.4,h5py==2.10.0,idna==2.10,importlib-metadata==1.7.0,itsdangerous==1.1.0,jaeger-client==4.1.0,Jinja2==2.11.2,jsonschema==3.2.0,Keras-Preprocessing==1.1.2,Markdown==3.2.2,MarkupSafe==1.1.1,minio==5.0.10,numpy==1.19.0,oauthlib==3.1.0,opentracing==2.2.0,opt-einsum==3.2.1,pip-licenses==2.2.1,prometheus-client==0.8.0,protobuf==3.12.2,PTable==0.9.2,pyasn1==0.4.8,pyasn1-modules==0.2.8,pycparser==2.20,pyrsistent==0.16.0,python-dateutil==2.8.1,pytz==2020.1,PyYAML==5.3.1,redis==3.5.3,requests==2.24.0,requests-oauthlib==1.3.0,rsa==4.6,scipy==1.4.1,seldon-core @ file:///workspace/source/python/.tox/.tmp/package/1/seldon-core-1.2.2.dev0.zip,six==1.15.0,tensorboard==2.2.2,tensorboard-plugin-wit==1.7.0,tensorflow==2.2.0,tensorflow-estimator==2.2.0,termcolor==1.1.0,threadloop==1.0.2,thrift==0.13.0,tornado==5.1.1,urllib3==1.25.9,Werkzeug==1.0.1,wrapt==1.12.1,zipp==3.1.0
licenses run-test-pre: PYTHONHASHSEED='3752866223'
licenses run-test: commands[0] | pip-licenses --from=mixed --format=csv --output-file=./licenses/license_info.csv
created path: ./licenses/license_info.csv
licenses run-test: commands[1] | pip-licenses --from=mixed --format=plain-vertical --with-license-file --no-license-path --output-file=./licenses/license.txt
created path: ./licenses/license.txt
___________________________________ summary ____________________________________
  licenses: commands succeeded
  congratulations :)
cut -d, -f1,3 ./licenses/license_info.csv \
	> ./licenses/license_info.no_versions.csv
black \
	--check ./ ../testing \
	--exclude "(testing/scripts/proto|seldon_core/proto/|.eggs|.tox)"
All done! ✨ 🍰 ✨
75 files would be left unchanged.
flake8
0
# Check if licenses have changed
git \
	--no-pager diff \
	--exit-code \
	./licenses/license_info.no_versions.csv
make: Leaving directory '/workspace/source/python'

Showing logs for build [32mseldonio-seldon-core-pr-2149-li-ptfwh-23[0m stage [32mlint-executor[0m and container [32mstep-credential-initializer-jlqnh[0m
{"level":"info","ts":1595052046.5979986,"logger":"fallback-logger","caller":"logging/config.go:69","msg":"Fetch GitHub commit ID from kodata failed: open /var/run/ko/refs/heads/0.8.0-ns-support: no such file or directory"}
{"level":"info","ts":1595052046.5984592,"logger":"fallback-logger","caller":"creds-init/main.go:40","msg":"Credentials initialized."}

Showing logs for build [32mseldonio-seldon-core-pr-2149-li-ptfwh-23[0m stage [32mlint-executor[0m and container [32mstep-working-dir-initializer-v48v4[0m
{"level":"info","ts":1595052047.9318225,"logger":"fallback-logger","caller":"logging/config.go:69","msg":"Fetch GitHub commit ID from kodata failed: open /var/run/ko/HEAD: no such file or directory"}
{"level":"info","ts":1595052047.9337602,"logger":"fallback-logger","caller":"bash/main.go:64","msg":"Successfully executed command \"sh -c mkdir -p /workspace/source\"; output "}

Showing logs for build [32mseldonio-seldon-core-pr-2149-li-ptfwh-23[0m stage [32mlint-executor[0m and container [32mstep-place-tools[0m

Showing logs for build [32mseldonio-seldon-core-pr-2149-li-ptfwh-23[0m stage [32mlint-executor[0m and container [32mstep-create-dir-workspace-24c94[0m
{"level":"info","ts":1595052056.4833505,"logger":"fallback-logger","caller":"logging/config.go:69","msg":"Fetch GitHub commit ID from kodata failed: open /var/run/ko/HEAD: no such file or directory"}
{"level":"info","ts":1595052056.4847012,"logger":"fallback-logger","caller":"bash/main.go:64","msg":"Successfully executed command \"sh -c mkdir -p /workspace/source\"; output "}

Showing logs for build [32mseldonio-seldon-core-pr-2149-li-ptfwh-23[0m stage [32mlint-executor[0m and container [32mstep-source-copy-workspace-h6c9n[0m
{"level":"info","ts":1595052056.7357454,"logger":"fallback-logger","caller":"logging/config.go:69","msg":"Fetch GitHub commit ID from kodata failed: open /var/run/ko/HEAD: no such file or directory"}
{"level":"info","ts":1595052057.0927358,"logger":"fallback-logger","caller":"bash/main.go:64","msg":"Successfully executed command \"sh -c cp -r /pvc/pr-build-comment/workspace/. /workspace/source\"; output "}

Showing logs for build [32mseldonio-seldon-core-pr-2149-li-ptfwh-23[0m stage [32mlint-executor[0m and container [32mstep-setup-builder-home[0m

Showing logs for build [32mseldonio-seldon-core-pr-2149-li-ptfwh-23[0m stage [32mlint-executor[0m and container [32mstep-lint-executor[0m
make: Entering directory '/workspace/source/executor'
# Check if licenses have changed
git \
	--no-pager diff \
	--exit-code \
	./licenses
make: Leaving directory '/workspace/source/executor'
