
Showing logs for build [32mseldonio-seldon-core-pr-2469-li-t7s5h-27[0m stage [32mpr-build-comment[0m and container [32mstep-credential-initializer-nb44s[0m
{"level":"info","ts":1601057969.0900414,"logger":"fallback-logger","caller":"logging/config.go:69","msg":"Fetch GitHub commit ID from kodata failed: open /var/run/ko/refs/heads/0.8.0-ns-support: no such file or directory"}
{"level":"info","ts":1601057969.090642,"logger":"fallback-logger","caller":"creds-init/main.go:40","msg":"Credentials initialized."}

Showing logs for build [32mseldonio-seldon-core-pr-2469-li-t7s5h-27[0m stage [32mpr-build-comment[0m and container [32mstep-working-dir-initializer-d6f5h[0m
{"level":"info","ts":1601057970.267703,"logger":"fallback-logger","caller":"logging/config.go:69","msg":"Fetch GitHub commit ID from kodata failed: open /var/run/ko/HEAD: no such file or directory"}
{"level":"info","ts":1601057970.2713885,"logger":"fallback-logger","caller":"bash/main.go:64","msg":"Successfully executed command \"sh -c mkdir -p /workspace/source\"; output "}

Showing logs for build [32mseldonio-seldon-core-pr-2469-li-t7s5h-27[0m stage [32mpr-build-comment[0m and container [32mstep-place-tools[0m

Showing logs for build [32mseldonio-seldon-core-pr-2469-li-t7s5h-27[0m stage [32mpr-build-comment[0m and container [32mstep-create-dir-workspace-9vbvf[0m
{"level":"info","ts":1601057975.3357208,"logger":"fallback-logger","caller":"logging/config.go:69","msg":"Fetch GitHub commit ID from kodata failed: open /var/run/ko/HEAD: no such file or directory"}
{"level":"info","ts":1601057975.3382485,"logger":"fallback-logger","caller":"bash/main.go:64","msg":"Successfully executed command \"sh -c mkdir -p source\"; output "}

Showing logs for build [32mseldonio-seldon-core-pr-2469-li-t7s5h-27[0m stage [32mpr-build-comment[0m and container [32mstep-git-source-seldonio-seldon-core-pr-2469-li-t7s5h-v7j56[0m
{"level":"info","ts":1601057975.6737518,"logger":"fallback-logger","caller":"logging/config.go:69","msg":"Fetch GitHub commit ID from kodata failed: open /var/run/ko/refs/heads/0.8.0-ns-support: no such file or directory"}
{"level":"info","ts":1601057986.6498044,"logger":"fallback-logger","caller":"git/git.go:103","msg":"Successfully cloned https://github.com/SeldonIO/seldon-core.git @ master in path /workspace/source"}

Showing logs for build [32mseldonio-seldon-core-pr-2469-li-t7s5h-27[0m stage [32mpr-build-comment[0m and container [32mstep-setup-builder-home[0m

Showing logs for build [32mseldonio-seldon-core-pr-2469-li-t7s5h-27[0m stage [32mpr-build-comment[0m and container [32mstep-git-merge[0m
Using SHAs from PULL_REFS=master:938a8ffd19fc321eed4c7347ef56cc0b59f448dd,2469:3eb74de5b8f32dae1b811204b7d60a691b9cc413
DEBUG: LC_ALL=C JX_LOG_LEVEL=error git fetch origin --unshallow 3eb74de5b8f32dae1b811204b7d60a691b9cc413: 938a8ffd19fc321eed4c7347ef56cc0b59f448dd:
DEBUG: ran git fetch --unshallow origin 3eb74de5b8f32dae1b811204b7d60a691b9cc413: 938a8ffd19fc321eed4c7347ef56cc0b59f448dd: in 
DEBUG: LC_ALL=C JX_LOG_LEVEL=error git branch
DEBUG: LC_ALL=C JX_LOG_LEVEL=error git checkout master
DEBUG: ran git checkout master in 
DEBUG: JX_LOG_LEVEL=error LC_ALL=C git reset --hard 938a8ffd19fc321eed4c7347ef56cc0b59f448dd
DEBUG: ran git reset --hard 938a8ffd19fc321eed4c7347ef56cc0b59f448dd in 
DEBUG: LC_ALL=C JX_LOG_LEVEL=error git clean -fd .
DEBUG: ran clean --force -d . in 
DEBUG: LC_ALL=C JX_LOG_LEVEL=error git merge 3eb74de5b8f32dae1b811204b7d60a691b9cc413
DEBUG: ran git merge 3eb74de5b8f32dae1b811204b7d60a691b9cc413 in 
DEBUG: LC_ALL=C JX_LOG_LEVEL=error git log --format=%H%x1f%an%x1f%ae%x1f%cn%x1f%ce%x1f%s%n%b%x1e 938a8ffd19fc321eed4c7347ef56cc0b59f448dd..HEAD
Merged SHA 3eb74de5b8f32dae1b811204b7d60a691b9cc413 with commit message 'Updated formatting' into base branch master
Merged SHA 849a7d6f7c82311729fc30df89a56ec49d3d5384 with commit message 'Updated custom metrics model documentation' into base branch master
Merged SHA 3bca54070296bd5d65743e90671302477ac7ea41 with commit message 'Updated runtime_metrics_tags' into base branch master
Merged SHA 12aacd53899486974dc9a6a7cccbfbd0256e7bf7 with commit message 'Added example' into base branch master
Merged SHA cb6531d56ee72adb249c358bfb65a890d98b70c9 with commit message 'Removed extra logging' into base branch master
Merged SHA 3c17f62760c2967fc702fbd5b580ad8fd6ab472a with commit message 'Updated example to include kservice and deployment' into base branch master
Merged SHA 845fbcf559e7ff90895355097a8b50916c6ed31c with commit message 'Working kservice and deployment' into base branch master
Merged SHA fc890a66e097e6e39a19792bb4bb1c6449ca9566 with commit message 'Fixing image deploy' into base branch master
Merged SHA cd4917dd247f2054765e9364e80f615780c334ec with commit message 'Updated example' into base branch master
Merged SHA f9eaba80dd01cf4fe2f29265bca1a11bf7495863 with commit message 'Initial assessment of dependencies' into base branch master
Merged SHA 52f09c58785752ae44f02bb8667c547712d752d0 with commit message 'Updated doc' into base branch master
Merged SHA fd8f2c2c3f8045b8832d04def547ca345740bf74 with commit message 'Added functionality for distinct tags for metrics' into base branch master
Merged SHA 5341a0e50e4523d7f6909012e6ed708224d45e5d with commit message 'Added tests for adserver' into base branch master
Merged SHA 665fbad4e1d377a9444614158f3704323e861041 with commit message 'Extended to enable local model import as well' into base branch master
Merged SHA 464f8ffe2702ecf0a9291c8d09acba7bbc76aa6e with commit message 'Updated to abstract into model classes' into base branch master
Merged SHA bf533905ca3703bfd4f9da8355420a81c75ca744 with commit message 'Added enum for comparison' into base branch master
Merged SHA da5f19d3218d5f52858aaac7613e6783538ab883 with commit message 'Added logic for multiclass classification one hot and numeric' into base branch master
Merged SHA 452712c4cb26c85596d3a468ebc155cb3a561fa3 with commit message 'Added curl for metrics server and actula metrics' into base branch master
Merged SHA 89b476804b4f4842fc622803dda4a2ca8a52bfc5 with commit message 'Added feedback converter' into base branch master
Merged SHA 89e850148bb902d6f963ee658f628a4f0bbf1a4d with commit message 'Added example fo makefile' into base branch master
Merged SHA 62aa73ad558cf63c3241c828cd34f6e754f3f854 with commit message 'Updated dockefile to work with non requirements.txt' into base branch master
Merged SHA 047c31417ad65f4e80bf4f5ef3b821132d8d700d with commit message 'removed stateful metrics server' into base branch master
Merged SHA cc90872b7aa21b8a9131dee8f10b3319da5c11c7 with commit message 'Updated dependencies to work with existing metric server' into base branch master
Merged SHA e4434974eff9babd27af6b54828572febd79d14b with commit message 'Updated adserver to host metrics and custom server' into base branch master
Merged SHA e8c9840e5ef65bc5cce709cc1121b381a034a68b with commit message 'Updated executor to send the feedback to the server' into base branch master
Merged SHA 45750438e55504e97a155c805ae1470ed228dfb7 with commit message 'Updated the metrics server' into base branch master
Merged SHA eaddbc6adc63da4be730478b624322134a9d2bfb with commit message 'Added metrics server component' into base branch master
Merged SHA 5cb2219b8e1ab32039c05c84e5d8ddc84a89b1a2 with commit message 'Updated to store feedback in request logger' into base branch master

Showing logs for build [32mseldonio-seldon-core-pr-2469-li-t7s5h-27[0m stage [32mpr-build-comment[0m and container [32mstep-step2[0m
+++ dirname ./add-pr-build-comment
++ cd .
++ pwd
+ STARTUP_DIR=/workspace/source/ci
+ REPO_OWNER=SeldonIO
+ REPO_NAME=seldon-core
+ PULL_NUMBER=2469
+ BUILD_NUMBER=27
+ PIPELINE_CONTEXT=lint
++ cat
+++ date
+ COMMENT_MSG='Fri Sep 25 18:19:56 UTC 2020
The logs for [lint] [27] will show after the pipeline context has finished.  
https://github.com/SeldonIO/seldon-core/blob/gh-pages/jenkins-x/logs/SeldonIO/seldon-core/PR-2469/27.log

impatient try  
** get build logs SeldonIO/seldon-core/PR-2469 --build=27'
+ ** step pr comment --owner=SeldonIO --repository=seldon-core --pull-request=2469 '--comment=Fri Sep 25 18:19:56 UTC 2020
The logs for [lint] [27] will show after the pipeline context has finished.  
https://github.com/SeldonIO/seldon-core/blob/gh-pages/jenkins-x/logs/SeldonIO/seldon-core/PR-2469/27.log

impatient try  
** get build logs SeldonIO/seldon-core/PR-2469 --build=27'

Showing logs for build [32mseldonio-seldon-core-pr-2469-li-t7s5h-27[0m stage [32mpr-build-comment[0m and container [32mstep-source-mkdir-seldonio-seldon-core-pr-2469-li-t7s5h-q89tc[0m
{"level":"info","ts":1601057998.8785715,"logger":"fallback-logger","caller":"logging/config.go:69","msg":"Fetch GitHub commit ID from kodata failed: open /var/run/ko/HEAD: no such file or directory"}
{"level":"info","ts":1601057998.8832376,"logger":"fallback-logger","caller":"bash/main.go:64","msg":"Successfully executed command \"sh -c mkdir -p /pvc/pr-build-comment/workspace\"; output "}

Showing logs for build [32mseldonio-seldon-core-pr-2469-li-t7s5h-27[0m stage [32mpr-build-comment[0m and container [32mstep-source-copy-seldonio-seldon-core-pr-2469-li-t7s5h-n6v8f[0m
{"level":"info","ts":1601057999.2035327,"logger":"fallback-logger","caller":"logging/config.go:69","msg":"Fetch GitHub commit ID from kodata failed: open /var/run/ko/HEAD: no such file or directory"}
{"level":"info","ts":1601057999.7590415,"logger":"fallback-logger","caller":"bash/main.go:64","msg":"Successfully executed command \"sh -c cp -r source/. /pvc/pr-build-comment/workspace\"; output "}

Showing logs for build [32mseldonio-seldon-core-pr-2469-li-t7s5h-27[0m stage [32mlint-operator[0m and container [32mstep-credential-initializer-26cnw[0m
{"level":"info","ts":1601058003.5100403,"logger":"fallback-logger","caller":"logging/config.go:69","msg":"Fetch GitHub commit ID from kodata failed: open /var/run/ko/refs/heads/0.8.0-ns-support: no such file or directory"}
{"level":"info","ts":1601058003.5106883,"logger":"fallback-logger","caller":"creds-init/main.go:40","msg":"Credentials initialized."}

Showing logs for build [32mseldonio-seldon-core-pr-2469-li-t7s5h-27[0m stage [32mlint-operator[0m and container [32mstep-working-dir-initializer-zs66z[0m
{"level":"info","ts":1601058004.531011,"logger":"fallback-logger","caller":"logging/config.go:69","msg":"Fetch GitHub commit ID from kodata failed: open /var/run/ko/HEAD: no such file or directory"}
{"level":"info","ts":1601058004.5332072,"logger":"fallback-logger","caller":"bash/main.go:64","msg":"Successfully executed command \"sh -c mkdir -p /workspace/source\"; output "}

Showing logs for build [32mseldonio-seldon-core-pr-2469-li-t7s5h-27[0m stage [32mlint-operator[0m and container [32mstep-place-tools[0m

Showing logs for build [32mseldonio-seldon-core-pr-2469-li-t7s5h-27[0m stage [32mlint-operator[0m and container [32mstep-create-dir-workspace-q2szp[0m
{"level":"info","ts":1601058014.1699064,"logger":"fallback-logger","caller":"logging/config.go:69","msg":"Fetch GitHub commit ID from kodata failed: open /var/run/ko/HEAD: no such file or directory"}
{"level":"info","ts":1601058014.172029,"logger":"fallback-logger","caller":"bash/main.go:64","msg":"Successfully executed command \"sh -c mkdir -p /workspace/source\"; output "}

Showing logs for build [32mseldonio-seldon-core-pr-2469-li-t7s5h-27[0m stage [32mlint-operator[0m and container [32mstep-source-copy-workspace-lw9lw[0m
{"level":"info","ts":1601058014.5042014,"logger":"fallback-logger","caller":"logging/config.go:69","msg":"Fetch GitHub commit ID from kodata failed: open /var/run/ko/HEAD: no such file or directory"}
{"level":"info","ts":1601058015.0168073,"logger":"fallback-logger","caller":"bash/main.go:64","msg":"Successfully executed command \"sh -c cp -r /pvc/pr-build-comment/workspace/. /workspace/source\"; output "}

Showing logs for build [32mseldonio-seldon-core-pr-2469-li-t7s5h-27[0m stage [32mlint-operator[0m and container [32mstep-setup-builder-home[0m

Showing logs for build [32mseldonio-seldon-core-pr-2469-li-t7s5h-27[0m stage [32mlint-operator[0m and container [32mstep-lint-operator[0m
make: Entering directory '/workspace/source/operator'
go list -m all | cut -d ' ' -f 1 > licenses/dep.txt
# Check if licenses have changed
git \
	--no-pager diff \
	--exit-code \
	./licenses
make: Leaving directory '/workspace/source/operator'

Showing logs for build [32mseldonio-seldon-core-pr-2469-li-t7s5h-27[0m stage [32mlint-python[0m and container [32mstep-credential-initializer-t24jv[0m
{"level":"info","ts":1601058004.412168,"logger":"fallback-logger","caller":"logging/config.go:69","msg":"Fetch GitHub commit ID from kodata failed: open /var/run/ko/refs/heads/0.8.0-ns-support: no such file or directory"}
{"level":"info","ts":1601058004.4127777,"logger":"fallback-logger","caller":"creds-init/main.go:40","msg":"Credentials initialized."}

Showing logs for build [32mseldonio-seldon-core-pr-2469-li-t7s5h-27[0m stage [32mlint-python[0m and container [32mstep-working-dir-initializer-rqvks[0m
{"level":"info","ts":1601058006.0228467,"logger":"fallback-logger","caller":"logging/config.go:69","msg":"Fetch GitHub commit ID from kodata failed: open /var/run/ko/HEAD: no such file or directory"}
{"level":"info","ts":1601058006.0263946,"logger":"fallback-logger","caller":"bash/main.go:64","msg":"Successfully executed command \"sh -c mkdir -p /workspace/source\"; output "}

Showing logs for build [32mseldonio-seldon-core-pr-2469-li-t7s5h-27[0m stage [32mlint-python[0m and container [32mstep-place-tools[0m

Showing logs for build [32mseldonio-seldon-core-pr-2469-li-t7s5h-27[0m stage [32mlint-python[0m and container [32mstep-create-dir-workspace-5lcsh[0m
{"level":"info","ts":1601058014.511768,"logger":"fallback-logger","caller":"logging/config.go:69","msg":"Fetch GitHub commit ID from kodata failed: open /var/run/ko/HEAD: no such file or directory"}
{"level":"info","ts":1601058014.514411,"logger":"fallback-logger","caller":"bash/main.go:64","msg":"Successfully executed command \"sh -c mkdir -p /workspace/source\"; output "}

Showing logs for build [32mseldonio-seldon-core-pr-2469-li-t7s5h-27[0m stage [32mlint-python[0m and container [32mstep-source-copy-workspace-9kf44[0m
{"level":"info","ts":1601058015.0512753,"logger":"fallback-logger","caller":"logging/config.go:69","msg":"Fetch GitHub commit ID from kodata failed: open /var/run/ko/HEAD: no such file or directory"}
{"level":"info","ts":1601058015.8382099,"logger":"fallback-logger","caller":"bash/main.go:64","msg":"Successfully executed command \"sh -c cp -r /pvc/pr-build-comment/workspace/. /workspace/source\"; output "}

Showing logs for build [32mseldonio-seldon-core-pr-2469-li-t7s5h-27[0m stage [32mlint-python[0m and container [32mstep-setup-builder-home[0m

Showing logs for build [32mseldonio-seldon-core-pr-2469-li-t7s5h-27[0m stage [32mlint-python[0m and container [32mstep-lint-python[0m
make: Entering directory '/workspace/source/python'
pip install -e . -r requirements-dev.txt
Obtaining file:///workspace/source/python
Collecting black==19.10b0 (from -r requirements-dev.txt (line 2))
  Downloading https://files.pythonhosted.org/packages/fd/bb/ad34bbc93d1bea3de086d7c59e528d4a503ac8fe318bd1fa48605584c3d2/black-19.10b0-py36-none-any.whl (97kB)
Collecting flake8==3.8.1 (from -r requirements-dev.txt (line 3))
  Downloading https://files.pythonhosted.org/packages/bf/47/36e51603431e1a5289eb41636199d2c225fcb1ca286e29c02d219c8e6e88/flake8-3.8.1-py2.py3-none-any.whl (72kB)
Collecting mypy<0.783 (from -r requirements-dev.txt (line 4))
  Downloading https://files.pythonhosted.org/packages/a7/25/da35a577040effa507d465102a0e001b29279d759f46218af91985ab0392/mypy-0.782-cp37-cp37m-manylinux1_x86_64.whl (20.8MB)
Collecting Pillow==7.2.0 (from -r requirements-dev.txt (line 5))
  Downloading https://files.pythonhosted.org/packages/e8/f2/6722dd0c22e3a143ac792ccb2424924ac72af4adea756b1165b4cad50da7/Pillow-7.2.0-cp37-cp37m-manylinux1_x86_64.whl (2.2MB)
Collecting pytest==6.0.2 (from -r requirements-dev.txt (line 6))
  Downloading https://files.pythonhosted.org/packages/45/2c/7e29215cb19745ad67b6476b73fd1299872563f28329ea01d9d887713aaf/pytest-6.0.2-py3-none-any.whl (270kB)
Collecting pytest-cov==2.10.1 (from -r requirements-dev.txt (line 7))
  Downloading https://files.pythonhosted.org/packages/e5/18/401594af67eda194a8b9167208621761927c937db7d60292608342bbac0a/pytest_cov-2.10.1-py2.py3-none-any.whl
Collecting tox<4.0.0 (from -r requirements-dev.txt (line 8))
  Downloading https://files.pythonhosted.org/packages/54/8f/058a8d4255a106f79fd51421a2d90ef904ab1dbed03803ea91c5c7a401dc/tox-3.20.0-py2.py3-none-any.whl (83kB)
Collecting grpcio-tools==1.32.0 (from -r requirements-dev.txt (line 9))
  Downloading https://files.pythonhosted.org/packages/5c/5b/6eb80634fa6092d696fe300644f73ecfd7c686ba1c126622ed3c2cb29bf2/grpcio-tools-1.32.0.tar.gz (2.1MB)
Collecting mypy-protobuf==1.22 (from -r requirements-dev.txt (line 10))
  Downloading https://files.pythonhosted.org/packages/ec/9c/36adfc9a4aee35f8c6ae45f91cb3ef2e041e4c9ef6be1401e369f46c47c6/mypy_protobuf-1.22-py3-none-any.whl
Collecting tenacity==6.2.0 (from -r requirements-dev.txt (line 13))
  Downloading https://files.pythonhosted.org/packages/b5/05/ff089032442058bd3386f9cd991cd88ccac81dca1494d78751621ee35e62/tenacity-6.2.0-py2.py3-none-any.whl
Collecting coverage==5.3 (from -r requirements-dev.txt (line 16))
  Downloading https://files.pythonhosted.org/packages/f9/67/cf7584c4fe27083710d3e43ffa26219b1e178a8bf506a762c76baf4937d6/coverage-5.3-cp37-cp37m-manylinux1_x86_64.whl (229kB)
Collecting pandas==1.1.0 (from -r requirements-dev.txt (line 19))
  Downloading https://files.pythonhosted.org/packages/94/b1/f77f49cc7cc538b247f30c2ae7e3a50f29e44f0b1af32ff4869d7de3c762/pandas-1.1.0-cp37-cp37m-manylinux1_x86_64.whl (10.5MB)
Collecting pip-licenses==2.3.0 (from -r requirements-dev.txt (line 22))
  Downloading https://files.pythonhosted.org/packages/c5/50/6c4b4e69a0c43bd9f03a30579695093062ba72da4e3e4026cd2144dbcc71/pip_licenses-2.3.0-py3-none-any.whl
Collecting Flask<2.0.0 (from seldon-core==1.3.0.dev0)
  Downloading https://files.pythonhosted.org/packages/f2/28/2a03252dfb9ebf377f40fba6a7841b47083260bf8bd8e737b0c6952df83f/Flask-1.1.2-py2.py3-none-any.whl (94kB)
Collecting jsonschema<4.0.0 (from seldon-core==1.3.0.dev0)
  Downloading https://files.pythonhosted.org/packages/c5/8f/51e89ce52a085483359217bc72cdbf6e75ee595d5b1d4b5ade40c7e018b8/jsonschema-3.2.0-py2.py3-none-any.whl (56kB)
Collecting Flask-cors<4.0.0 (from seldon-core==1.3.0.dev0)
  Downloading https://files.pythonhosted.org/packages/69/7f/d0aeaaafb5c3c76c8d2141dbe2d4f6dca5d6c31872d4e5349768c1958abc/Flask_Cors-3.0.9-py2.py3-none-any.whl
Collecting redis<4.0.0 (from seldon-core==1.3.0.dev0)
  Downloading https://files.pythonhosted.org/packages/a7/7c/24fb0511df653cf1a5d938d8f5d19802a88cef255706fdda242ff97e91b7/redis-3.5.3-py2.py3-none-any.whl (72kB)
Requirement already satisfied: requests<3.0.0 in /opt/conda/lib/python3.7/site-packages (from seldon-core==1.3.0.dev0) (2.21.0)
Collecting numpy<2.0.0 (from seldon-core==1.3.0.dev0)
  Downloading https://files.pythonhosted.org/packages/d6/2e/a2dbcff6f46bb65645d18538d67183a1cf56b006ba96a12575c282a976bc/numpy-1.19.2-cp37-cp37m-manylinux1_x86_64.whl (13.4MB)
Requirement already satisfied: flatbuffers<2.0.0 in /opt/conda/lib/python3.7/site-packages (from seldon-core==1.3.0.dev0) (1.11)
Requirement already satisfied: protobuf<4.0.0 in /opt/conda/lib/python3.7/site-packages (from seldon-core==1.3.0.dev0) (3.7.1)
Requirement already satisfied: grpcio<2.0.0 in /opt/conda/lib/python3.7/site-packages (from seldon-core==1.3.0.dev0) (1.20.1)
Collecting Flask-OpenTracing<1.2.0,>=1.1.0 (from seldon-core==1.3.0.dev0)
  Downloading https://files.pythonhosted.org/packages/58/6c/6417701ba5ecc8854670c6db3207bcc3e5fbc96289a7cb18d5516d99a1c6/Flask-OpenTracing-1.1.0.tar.gz
Collecting opentracing<2.4.0,>=2.2.0 (from seldon-core==1.3.0.dev0)
  Downloading https://files.pythonhosted.org/packages/e4/a8/df5285f42cd07782409d0ae835785fae6e2a0f7e8b0036ea302f1422fd25/opentracing-2.3.0.tar.gz (48kB)
Collecting jaeger-client<4.4.0,>=4.1.0 (from seldon-core==1.3.0.dev0)
  Downloading https://files.pythonhosted.org/packages/2b/75/17a937a61135671cebc175ab5c299dc0f7477042469482fd9a6f91262c68/jaeger-client-4.3.0.tar.gz (81kB)
Collecting grpcio-opentracing<1.2.0,>=1.1.4 (from seldon-core==1.3.0.dev0)
  Downloading https://files.pythonhosted.org/packages/db/82/2fcad380697c3dab25de76ee590bcab3eb9bbfb4add916044d7e83ec2b10/grpcio_opentracing-1.1.4-py3-none-any.whl
Collecting PyYAML<5.4 (from seldon-core==1.3.0.dev0)
  Downloading https://files.pythonhosted.org/packages/64/c2/b80047c7ac2478f9501676c988a5411ed5572f35d1beff9cae07d321512c/PyYAML-5.3.1.tar.gz (269kB)
Collecting gunicorn<20.1.0,>=19.9.0 (from seldon-core==1.3.0.dev0)
  Downloading https://files.pythonhosted.org/packages/69/ca/926f7cd3a2014b16870086b2d0fdc84a9e49473c68a8dff8b57f7c156f43/gunicorn-20.0.4-py2.py3-none-any.whl (77kB)
Collecting setuptools>=41.0.0 (from seldon-core==1.3.0.dev0)
  Downloading https://files.pythonhosted.org/packages/44/a6/7fb6e8b3f4a6051e72e4e2218889351f0ee484b9ee17e995f5ccff780300/setuptools-50.3.0-py3-none-any.whl (785kB)
Collecting prometheus_client<0.9.0,>=0.7.1 (from seldon-core==1.3.0.dev0)
  Downloading https://files.pythonhosted.org/packages/3f/0e/554a265ffdc56e1494ef08e18f765b0cdec78797f510c58c45cf37abb4f4/prometheus_client-0.8.0-py2.py3-none-any.whl (53kB)
Collecting click>=6.5 (from black==19.10b0->-r requirements-dev.txt (line 2))
  Downloading https://files.pythonhosted.org/packages/d2/3d/fa76db83bf75c4f8d338c2fd15c8d33fdd7ad23a9b5e57eb6c5de26b430e/click-7.1.2-py2.py3-none-any.whl (82kB)
Collecting appdirs (from black==19.10b0->-r requirements-dev.txt (line 2))
  Downloading https://files.pythonhosted.org/packages/3b/00/2344469e2084fb287c2e0b57b72910309874c3245463acd6cf5e3db69324/appdirs-1.4.4-py2.py3-none-any.whl
Collecting typed-ast>=1.4.0 (from black==19.10b0->-r requirements-dev.txt (line 2))
  Downloading https://files.pythonhosted.org/packages/5d/10/0c1e8aa723a2b0c4032e048d8e511df82c8a1262f0e1df5e4c54eb2613e9/typed_ast-1.4.1-cp37-cp37m-manylinux1_x86_64.whl (737kB)
Collecting pathspec<1,>=0.6 (from black==19.10b0->-r requirements-dev.txt (line 2))
  Downloading https://files.pythonhosted.org/packages/5d/d0/887c58853bd4b6ffc7aa9cdba4fc57d7b979b45888a6bd47e4568e1cf868/pathspec-0.8.0-py2.py3-none-any.whl
Collecting regex (from black==19.10b0->-r requirements-dev.txt (line 2))
  Downloading https://files.pythonhosted.org/packages/b6/0b/571619431d3ab416b9ffeca1fdf6cc1b388581b087250fb56e7227d16088/regex-2020.7.14-cp37-cp37m-manylinux1_x86_64.whl (660kB)
Collecting attrs>=18.1.0 (from black==19.10b0->-r requirements-dev.txt (line 2))
  Downloading https://files.pythonhosted.org/packages/14/df/479736ae1ef59842f512548bacefad1abed705e400212acba43f9b0fa556/attrs-20.2.0-py2.py3-none-any.whl (48kB)
Collecting toml>=0.9.4 (from black==19.10b0->-r requirements-dev.txt (line 2))
  Downloading https://files.pythonhosted.org/packages/9f/e1/1b40b80f2e1663a6b9f497123c11d7d988c0919abbf3c3f2688e448c5363/toml-0.10.1-py2.py3-none-any.whl
Collecting importlib-metadata; python_version < "3.8" (from flake8==3.8.1->-r requirements-dev.txt (line 3))
  Downloading https://files.pythonhosted.org/packages/6d/6d/f4bb28424bc677bce1210bc19f69a43efe823e294325606ead595211f93e/importlib_metadata-2.0.0-py2.py3-none-any.whl
Collecting pyflakes<2.3.0,>=2.2.0 (from flake8==3.8.1->-r requirements-dev.txt (line 3))
  Downloading https://files.pythonhosted.org/packages/69/5b/fd01b0c696f2f9a6d2c839883b642493b431f28fa32b29abc465ef675473/pyflakes-2.2.0-py2.py3-none-any.whl (66kB)
Collecting mccabe<0.7.0,>=0.6.0 (from flake8==3.8.1->-r requirements-dev.txt (line 3))
  Downloading https://files.pythonhosted.org/packages/87/89/479dc97e18549e21354893e4ee4ef36db1d237534982482c3681ee6e7b57/mccabe-0.6.1-py2.py3-none-any.whl
Collecting pycodestyle<2.7.0,>=2.6.0a1 (from flake8==3.8.1->-r requirements-dev.txt (line 3))
  Downloading https://files.pythonhosted.org/packages/10/5b/88879fb861ab79aef45c7e199cae3ef7af487b5603dcb363517a50602dd7/pycodestyle-2.6.0-py2.py3-none-any.whl (41kB)
Collecting mypy-extensions<0.5.0,>=0.4.3 (from mypy<0.783->-r requirements-dev.txt (line 4))
  Downloading https://files.pythonhosted.org/packages/5c/eb/975c7c080f3223a5cdaff09612f3a5221e4ba534f7039db34c35d95fa6a5/mypy_extensions-0.4.3-py2.py3-none-any.whl
Collecting typing-extensions>=3.7.4 (from mypy<0.783->-r requirements-dev.txt (line 4))
  Downloading https://files.pythonhosted.org/packages/60/7a/e881b5abb54db0e6e671ab088d079c57ce54e8a01a3ca443f561ccadb37e/typing_extensions-3.7.4.3-py3-none-any.whl
Collecting iniconfig (from pytest==6.0.2->-r requirements-dev.txt (line 6))
  Downloading https://files.pythonhosted.org/packages/20/46/d2f4919cc48c39c2cb48b589ca9016aae6bad050b8023667eb86950d3da2/iniconfig-1.0.1-py3-none-any.whl
Collecting packaging (from pytest==6.0.2->-r requirements-dev.txt (line 6))
  Downloading https://files.pythonhosted.org/packages/46/19/c5ab91b1b05cfe63cccd5cfc971db9214c6dd6ced54e33c30d5af1d2bc43/packaging-20.4-py2.py3-none-any.whl
Collecting more-itertools>=4.0.0 (from pytest==6.0.2->-r requirements-dev.txt (line 6))
  Downloading https://files.pythonhosted.org/packages/ec/f7/9c33f38577d9fb9b1aa60c0fd9961d09574f5d47d2b830e5183e6adfc8cc/more_itertools-8.5.0-py3-none-any.whl (44kB)
Collecting py>=1.8.2 (from pytest==6.0.2->-r requirements-dev.txt (line 6))
  Downloading https://files.pythonhosted.org/packages/68/0f/41a43535b52a81e4f29e420a151032d26f08b62206840c48d14b70e53376/py-1.9.0-py2.py3-none-any.whl (99kB)
Collecting pluggy<1.0,>=0.12 (from pytest==6.0.2->-r requirements-dev.txt (line 6))
  Downloading https://files.pythonhosted.org/packages/a0/28/85c7aa31b80d150b772fbe4a229487bc6644da9ccb7e427dd8cc60cb8a62/pluggy-0.13.1-py2.py3-none-any.whl
Collecting six>=1.14.0 (from tox<4.0.0->-r requirements-dev.txt (line 8))
  Downloading https://files.pythonhosted.org/packages/ee/ff/48bde5c0f013094d729fe4b0316ba2a24774b3ff1c52d924a8a4cb04078a/six-1.15.0-py2.py3-none-any.whl
Collecting filelock>=3.0.0 (from tox<4.0.0->-r requirements-dev.txt (line 8))
  Downloading https://files.pythonhosted.org/packages/93/83/71a2ee6158bb9f39a90c0dea1637f81d5eef866e188e1971a1b1ab01a35a/filelock-3.0.12-py3-none-any.whl
Collecting virtualenv!=20.0.0,!=20.0.1,!=20.0.2,!=20.0.3,!=20.0.4,!=20.0.5,!=20.0.6,!=20.0.7,>=16.0.0 (from tox<4.0.0->-r requirements-dev.txt (line 8))
  Downloading https://files.pythonhosted.org/packages/12/51/36c685ff2c1b2f7b4b5db29f3153159102ae0e0adaff3a26fd1448232e06/virtualenv-20.0.31-py2.py3-none-any.whl (4.9MB)
Collecting pytz>=2017.2 (from pandas==1.1.0->-r requirements-dev.txt (line 19))
  Downloading https://files.pythonhosted.org/packages/4f/a4/879454d49688e2fad93e59d7d4efda580b783c745fd2ec2a3adf87b0808d/pytz-2020.1-py2.py3-none-any.whl (510kB)
Collecting python-dateutil>=2.7.3 (from pandas==1.1.0->-r requirements-dev.txt (line 19))
  Downloading https://files.pythonhosted.org/packages/d4/70/d60450c3dd48ef87586924207ae8907090de0b306af2bce5d134d78615cb/python_dateutil-2.8.1-py2.py3-none-any.whl (227kB)
Collecting PTable (from pip-licenses==2.3.0->-r requirements-dev.txt (line 22))
  Downloading https://files.pythonhosted.org/packages/ab/b3/b54301811173ca94119eb474634f120a49cd370f257d1aae5a4abaf12729/PTable-0.9.2.tar.gz
Collecting Jinja2>=2.10.1 (from Flask<2.0.0->seldon-core==1.3.0.dev0)
  Downloading https://files.pythonhosted.org/packages/30/9e/f663a2aa66a09d838042ae1a2c5659828bb9b41ea3a6efa20a20fd92b121/Jinja2-2.11.2-py2.py3-none-any.whl (125kB)
Collecting Werkzeug>=0.15 (from Flask<2.0.0->seldon-core==1.3.0.dev0)
  Downloading https://files.pythonhosted.org/packages/cc/94/5f7079a0e00bd6863ef8f1da638721e9da21e5bacee597595b318f71d62e/Werkzeug-1.0.1-py2.py3-none-any.whl (298kB)
Collecting itsdangerous>=0.24 (from Flask<2.0.0->seldon-core==1.3.0.dev0)
  Downloading https://files.pythonhosted.org/packages/76/ae/44b03b253d6fade317f32c24d100b3b35c2239807046a4c953c7b89fa49e/itsdangerous-1.1.0-py2.py3-none-any.whl
Collecting pyrsistent>=0.14.0 (from jsonschema<4.0.0->seldon-core==1.3.0.dev0)
  Downloading https://files.pythonhosted.org/packages/4d/70/fd441df751ba8b620e03fd2d2d9ca902103119616f0f6cc42e6405035062/pyrsistent-0.17.3.tar.gz (106kB)
Requirement already satisfied: chardet<3.1.0,>=3.0.2 in /opt/conda/lib/python3.7/site-packages (from requests<3.0.0->seldon-core==1.3.0.dev0) (3.0.4)
Requirement already satisfied: idna<2.9,>=2.5 in /opt/conda/lib/python3.7/site-packages (from requests<3.0.0->seldon-core==1.3.0.dev0) (2.8)
Requirement already satisfied: urllib3<1.25,>=1.21.1 in /opt/conda/lib/python3.7/site-packages (from requests<3.0.0->seldon-core==1.3.0.dev0) (1.24.1)
Requirement already satisfied: certifi>=2017.4.17 in /opt/conda/lib/python3.7/site-packages (from requests<3.0.0->seldon-core==1.3.0.dev0) (2018.11.29)
Collecting threadloop<2,>=1 (from jaeger-client<4.4.0,>=4.1.0->seldon-core==1.3.0.dev0)
  Downloading https://files.pythonhosted.org/packages/d3/1d/8398c1645b97dc008d3c658e04beda01ede3d90943d40c8d56863cf891bd/threadloop-1.0.2.tar.gz
Collecting thrift (from jaeger-client<4.4.0,>=4.1.0->seldon-core==1.3.0.dev0)
  Downloading https://files.pythonhosted.org/packages/97/1e/3284d19d7be99305eda145b8aa46b0c33244e4a496ec66440dac19f8274d/thrift-0.13.0.tar.gz (59kB)
Collecting tornado>=4.3 (from jaeger-client<4.4.0,>=4.1.0->seldon-core==1.3.0.dev0)
  Downloading https://files.pythonhosted.org/packages/95/84/119a46d494f008969bf0c775cb2c6b3579d3c4cc1bb1b41a022aa93ee242/tornado-6.0.4.tar.gz (496kB)
Collecting zipp>=0.5 (from importlib-metadata; python_version < "3.8"->flake8==3.8.1->-r requirements-dev.txt (line 3))
  Downloading https://files.pythonhosted.org/packages/c4/79/3b770d51254a31bb85ba56ea70d7428d0c2c659a233cc9722352e028b539/zipp-3.2.0-py3-none-any.whl
Collecting pyparsing>=2.0.2 (from packaging->pytest==6.0.2->-r requirements-dev.txt (line 6))
  Downloading https://files.pythonhosted.org/packages/8a/bb/488841f56197b13700afd5658fc279a2025a39e22449b7cf29864669b15d/pyparsing-2.4.7-py2.py3-none-any.whl (67kB)
Collecting distlib<1,>=0.3.1 (from virtualenv!=20.0.0,!=20.0.1,!=20.0.2,!=20.0.3,!=20.0.4,!=20.0.5,!=20.0.6,!=20.0.7,>=16.0.0->tox<4.0.0->-r requirements-dev.txt (line 8))
  Downloading https://files.pythonhosted.org/packages/f5/0a/490fa011d699bb5a5f3a0cf57de82237f52a6db9d40f33c53b2736c9a1f9/distlib-0.3.1-py2.py3-none-any.whl (335kB)
Collecting MarkupSafe>=0.23 (from Jinja2>=2.10.1->Flask<2.0.0->seldon-core==1.3.0.dev0)
  Downloading https://files.pythonhosted.org/packages/98/7b/ff284bd8c80654e471b769062a9b43cc5d03e7a615048d96f4619df8d420/MarkupSafe-1.1.1-cp37-cp37m-manylinux1_x86_64.whl
Building wheels for collected packages: grpcio-tools, Flask-OpenTracing, opentracing, jaeger-client, PyYAML, PTable, pyrsistent, threadloop, thrift, tornado
  Running setup.py bdist_wheel for grpcio-tools: started
  Running setup.py bdist_wheel for grpcio-tools: still running...
  Running setup.py bdist_wheel for grpcio-tools: finished with status 'done'
  Stored in directory: /builder/home/.cache/pip/wheels/ef/49/23/a3a3701c090b0611219faa01bb15f2654ce15f566a251dff56
  Running setup.py bdist_wheel for Flask-OpenTracing: started
  Running setup.py bdist_wheel for Flask-OpenTracing: finished with status 'done'
  Stored in directory: /builder/home/.cache/pip/wheels/7b/dc/25/3cf0b35c129232ee596c413f13d1d1f5a8e38c427266276dfd
  Running setup.py bdist_wheel for opentracing: started
  Running setup.py bdist_wheel for opentracing: finished with status 'done'
  Stored in directory: /builder/home/.cache/pip/wheels/66/b5/60/322949294afda71a9558eb25a1e536d1191665ef71759646b7
  Running setup.py bdist_wheel for jaeger-client: started
  Running setup.py bdist_wheel for jaeger-client: finished with status 'done'
  Stored in directory: /builder/home/.cache/pip/wheels/a4/46/e1/316c9ea87f46b9685c2f4258950a27bad1ae072c56224e4489
  Running setup.py bdist_wheel for PyYAML: started
  Running setup.py bdist_wheel for PyYAML: finished with status 'done'
  Stored in directory: /builder/home/.cache/pip/wheels/a7/c1/ea/cf5bd31012e735dc1dfea3131a2d5eae7978b251083d6247bd
  Running setup.py bdist_wheel for PTable: started
  Running setup.py bdist_wheel for PTable: finished with status 'done'
  Stored in directory: /builder/home/.cache/pip/wheels/22/cc/2e/55980bfe86393df3e9896146a01f6802978d09d7ebcba5ea56
  Running setup.py bdist_wheel for pyrsistent: started
  Running setup.py bdist_wheel for pyrsistent: finished with status 'done'
  Stored in directory: /builder/home/.cache/pip/wheels/f0/b8/de/b593ad311be4eb458499d100db081e453576032272398b7ddc
  Running setup.py bdist_wheel for threadloop: started
  Running setup.py bdist_wheel for threadloop: finished with status 'done'
  Stored in directory: /builder/home/.cache/pip/wheels/d7/7a/30/d212623a4cd34f6cce400f8122b1b7af740d3440c68023d51f
  Running setup.py bdist_wheel for thrift: started
  Running setup.py bdist_wheel for thrift: finished with status 'done'
  Stored in directory: /builder/home/.cache/pip/wheels/02/a2/46/689ccfcf40155c23edc7cdbd9de488611c8fdf49ff34b1706e
  Running setup.py bdist_wheel for tornado: started
  Running setup.py bdist_wheel for tornado: finished with status 'done'
  Stored in directory: /builder/home/.cache/pip/wheels/93/84/2f/409c7b2bb3afc3aa727f7ee8787975e0793f74d1165f4d0104
Successfully built grpcio-tools Flask-OpenTracing opentracing jaeger-client PyYAML PTable pyrsistent threadloop thrift tornado
grpcio-tools 1.32.0 has requirement grpcio>=1.32.0, but you'll have grpcio 1.20.1 which is incompatible.
virtualenv 20.0.31 has requirement importlib-metadata<2,>=0.12; python_version < "3.8", but you'll have importlib-metadata 2.0.0 which is incompatible.
tox 3.20.0 has requirement importlib-metadata<2,>=0.12; python_version < "3.8", but you'll have importlib-metadata 2.0.0 which is incompatible.
Installing collected packages: click, appdirs, typed-ast, pathspec, regex, attrs, toml, black, zipp, importlib-metadata, pyflakes, mccabe, pycodestyle, flake8, mypy-extensions, typing-extensions, mypy, Pillow, iniconfig, six, pyparsing, packaging, more-itertools, py, pluggy, pytest, coverage, pytest-cov, filelock, distlib, virtualenv, tox, grpcio-tools, mypy-protobuf, tenacity, pytz, numpy, python-dateutil, pandas, PTable, pip-licenses, MarkupSafe, Jinja2, Werkzeug, itsdangerous, Flask, pyrsistent, setuptools, jsonschema, Flask-cors, redis, opentracing, Flask-OpenTracing, tornado, threadloop, thrift, jaeger-client, grpcio-opentracing, PyYAML, gunicorn, prometheus-client, seldon-core
  Found existing installation: six 1.12.0
    Uninstalling six-1.12.0:
      Successfully uninstalled six-1.12.0
  Found existing installation: grpcio-tools 1.20.1
    Uninstalling grpcio-tools-1.20.1:
      Successfully uninstalled grpcio-tools-1.20.1
  Found existing installation: mypy-protobuf 1.10
    Uninstalling mypy-protobuf-1.10:
      Successfully uninstalled mypy-protobuf-1.10
  Found existing installation: setuptools 40.6.3
    Uninstalling setuptools-40.6.3:
      Successfully uninstalled setuptools-40.6.3
  Running setup.py develop for seldon-core
Successfully installed Flask-1.1.2 Flask-OpenTracing-1.1.0 Flask-cors-3.0.9 Jinja2-2.11.2 MarkupSafe-1.1.1 PTable-0.9.2 Pillow-7.2.0 PyYAML-5.3.1 Werkzeug-1.0.1 appdirs-1.4.4 attrs-20.2.0 black-19.10b0 click-7.1.2 coverage-5.3 distlib-0.3.1 filelock-3.0.12 flake8-3.8.1 grpcio-opentracing-1.1.4 grpcio-tools-1.32.0 gunicorn-20.0.4 importlib-metadata-2.0.0 iniconfig-1.0.1 itsdangerous-1.1.0 jaeger-client-4.3.0 jsonschema-3.2.0 mccabe-0.6.1 more-itertools-8.5.0 mypy-0.782 mypy-extensions-0.4.3 mypy-protobuf-1.22 numpy-1.19.2 opentracing-2.3.0 packaging-20.4 pandas-1.1.0 pathspec-0.8.0 pip-licenses-2.3.0 pluggy-0.13.1 prometheus-client-0.8.0 py-1.9.0 pycodestyle-2.6.0 pyflakes-2.2.0 pyparsing-2.4.7 pyrsistent-0.17.3 pytest-6.0.2 pytest-cov-2.10.1 python-dateutil-2.8.1 pytz-2020.1 redis-3.5.3 regex-2020.7.14 seldon-core setuptools-50.3.0 six-1.15.0 tenacity-6.2.0 threadloop-1.0.2 thrift-0.13.0 toml-0.10.1 tornado-6.0.4 tox-3.20.0 typed-ast-1.4.1 typing-extensions-3.7.4.3 virtualenv-20.0.31 zipp-3.2.0
tox --recreate -e licenses
GLOB sdist-make: /workspace/source/python/setup.py
licenses create: /workspace/source/python/.tox/licenses
licenses installdeps: pip-licenses
licenses inst: /workspace/source/python/.tox/.tmp/package/1/seldon-core-1.3.0.dev0.zip
licenses installed: absl-py==0.10.0,astunparse==1.6.3,attrs==20.2.0,cachetools==4.1.1,certifi==2020.6.20,chardet==3.0.4,click==7.1.2,Flask==1.1.2,Flask-Cors==3.0.9,Flask-OpenTracing==1.1.0,flatbuffers==1.12,gast==0.3.3,google-auth==1.21.3,google-auth-oauthlib==0.4.1,google-pasta==0.2.0,grpcio==1.32.0,grpcio-opentracing==1.1.4,gunicorn==20.0.4,h5py==2.10.0,idna==2.10,importlib-metadata==2.0.0,itsdangerous==1.1.0,jaeger-client==4.3.0,Jinja2==2.11.2,jsonschema==3.2.0,Keras-Preprocessing==1.1.2,Markdown==3.2.2,MarkupSafe==1.1.1,numpy==1.19.2,oauthlib==3.1.0,opentracing==2.3.0,opt-einsum==3.3.0,pip-licenses==2.3.0,prometheus-client==0.8.0,protobuf==3.13.0,PTable==0.9.2,pyasn1==0.4.8,pyasn1-modules==0.2.8,pyrsistent==0.17.3,PyYAML==5.3.1,redis==3.5.3,requests==2.24.0,requests-oauthlib==1.3.0,rsa==4.6,seldon-core @ file:///workspace/source/python/.tox/.tmp/package/1/seldon-core-1.3.0.dev0.zip,six==1.15.0,tensorboard==2.3.0,tensorboard-plugin-wit==1.7.0,tensorflow==2.3.1,tensorflow-estimator==2.3.0,termcolor==1.1.0,threadloop==1.0.2,thrift==0.13.0,tornado==6.0.4,urllib3==1.25.10,Werkzeug==1.0.1,wrapt==1.12.1,zipp==3.2.0
licenses run-test-pre: PYTHONHASHSEED='1236396075'
licenses run-test: commands[0] | pip-licenses --from=mixed --format=csv --output-file=./licenses/license_info.csv
created path: ./licenses/license_info.csv
licenses run-test: commands[1] | pip-licenses --from=mixed --format=plain-vertical --with-license-file --no-license-path --output-file=./licenses/license.txt
created path: ./licenses/license.txt
___________________________________ summary ____________________________________
  licenses: commands succeeded
  congratulations :)
cut -d, -f1,3 ./licenses/license_info.csv \
	> ./licenses/license_info.no_versions.csv
black \
	--check ./ ../testing \
	--exclude "(testing/scripts/proto|seldon_core/proto/|.eggs|.tox)"
would reformat /workspace/source/python/tests/test_runtime_metrics_tags.py
would reformat /workspace/source/python/tests/test_metrics.py
Oh no! 💥 💔 💥
2 files would be reformatted, 79 files would be left unchanged.
make: *** [lint] Error 1
Makefile:106: recipe for target 'lint' failed
make: Leaving directory '/workspace/source/python'
[31m
Pipeline failed on stage 'lint-python' : container 'step-lint-python'. The execution of the pipeline has stopped.[0m

Showing logs for build [32mseldonio-seldon-core-pr-2469-li-t7s5h-27[0m stage [32mlint-executor[0m and container [32mstep-credential-initializer-8s9gh[0m
{"level":"info","ts":1601058005.6326764,"logger":"fallback-logger","caller":"logging/config.go:69","msg":"Fetch GitHub commit ID from kodata failed: open /var/run/ko/refs/heads/0.8.0-ns-support: no such file or directory"}
{"level":"info","ts":1601058005.6331697,"logger":"fallback-logger","caller":"creds-init/main.go:40","msg":"Credentials initialized."}

Showing logs for build [32mseldonio-seldon-core-pr-2469-li-t7s5h-27[0m stage [32mlint-executor[0m and container [32mstep-working-dir-initializer-g277k[0m
{"level":"info","ts":1601058007.1523888,"logger":"fallback-logger","caller":"logging/config.go:69","msg":"Fetch GitHub commit ID from kodata failed: open /var/run/ko/HEAD: no such file or directory"}
{"level":"info","ts":1601058007.1561239,"logger":"fallback-logger","caller":"bash/main.go:64","msg":"Successfully executed command \"sh -c mkdir -p /workspace/source\"; output "}

Showing logs for build [32mseldonio-seldon-core-pr-2469-li-t7s5h-27[0m stage [32mlint-executor[0m and container [32mstep-place-tools[0m

Showing logs for build [32mseldonio-seldon-core-pr-2469-li-t7s5h-27[0m stage [32mlint-executor[0m and container [32mstep-create-dir-workspace-29q45[0m
{"level":"info","ts":1601058014.6526065,"logger":"fallback-logger","caller":"logging/config.go:69","msg":"Fetch GitHub commit ID from kodata failed: open /var/run/ko/HEAD: no such file or directory"}
{"level":"info","ts":1601058014.6553903,"logger":"fallback-logger","caller":"bash/main.go:64","msg":"Successfully executed command \"sh -c mkdir -p /workspace/source\"; output "}

Showing logs for build [32mseldonio-seldon-core-pr-2469-li-t7s5h-27[0m stage [32mlint-executor[0m and container [32mstep-source-copy-workspace-ss7kk[0m
{"level":"info","ts":1601058015.0013514,"logger":"fallback-logger","caller":"logging/config.go:69","msg":"Fetch GitHub commit ID from kodata failed: open /var/run/ko/HEAD: no such file or directory"}
{"level":"info","ts":1601058015.733815,"logger":"fallback-logger","caller":"bash/main.go:64","msg":"Successfully executed command \"sh -c cp -r /pvc/pr-build-comment/workspace/. /workspace/source\"; output "}

Showing logs for build [32mseldonio-seldon-core-pr-2469-li-t7s5h-27[0m stage [32mlint-executor[0m and container [32mstep-setup-builder-home[0m

Showing logs for build [32mseldonio-seldon-core-pr-2469-li-t7s5h-27[0m stage [32mlint-executor[0m and container [32mstep-lint-executor[0m
make: Entering directory '/workspace/source/executor'
rm _operator -rf
cp -r ../operator _operator
go list -m all | cut -d ' ' -f 1 > licenses/dep.txt
# Check if licenses have changed
git \
	--no-pager diff \
	--exit-code \
	./licenses
make: Leaving directory '/workspace/source/executor'
